{
  "nav": {
    "system": "System",
    "science": "Science",
    "athletes": "Athletes",
    "team": "Team",
    "partnerGyms": "Partner Gyms",
    "applyCta": "Apply as Partner Gym",
    "downloadCta": "Download the App",
    "openMenu": "Open menu",
    "closeMenu": "Close menu",
    "switchLang": "Switch language"
  },
  "hero": {
    "eyebrow": "AI Performance Coach · Built in Vienna",
    "headline": "Engineer Performance. Deep Hack the Human Body.",
    "tagline": "You are unique. Train unique.",
    "sub": "Thalos connects training, nutrition, recovery and biometrics into one adaptive coaching system — so every plan responds to the body in front of it. No generic plans. No isolated numbers. One coach. Every signal.",
    "microline": "Stop guessing. Start adapting.",
    "ctaPrimary": "Download the App",
    "ctaSecondary": "Apply as Partner Gym"
  },
  "system": {
    "title": "One system. Every signal.",
    "pillars": {
      "workouts": { "title": "Workouts", "body": "Structured training. Logged, reviewed and connected to your performance history." },
      "meals": { "title": "Meals", "body": "Nutrition as protocol. Photos, macros, timing and corrections — linked to training and recovery." },
      "recovery": { "title": "Recovery", "body": "Sleep and fatigue are not excuses. They are training signals." },
      "data": { "title": "Data", "body": "Heart rate, HRV, sleep, active energy, steps, lactate and CGM where available — unified in one performance view." },
      "coach": { "title": "Coach", "body": "The AI reads the pattern and adapts the next move." }
    }
  },
  "productInMotion": {
    "title": "Your body speaks in signals. Thalos translates.",
    "slides": {
      "home": { "title": "Your day at a glance", "body": "See the key signals that shape today's training: sleep, recovery, heart rate, HRV, activity and readiness." },
      "sleep": { "title": "Recovery that counts", "body": "Sleep duration is not enough. Thalos looks at recovery quality, training load and trend — because adaptation happens between sessions." },
      "meals": { "title": "Macros in context", "body": "Calories, protein, carbs and fat only matter when they are connected to the work you do and the progress you want." },
      "training": { "title": "Training with feedback", "body": "Sets, reps, load, volume and effort become more than a log. They become the input for the next plan." },
      "notes": { "title": "Notes as signal", "body": "Illness, stress, travel, supplements, routines and missed data are not noise. They explain performance." }
    }
  },
  "science": {
    "eyebrow": "Science",
    "title": "Built from high-density human performance data.",
    "body": "Thalos is developed around a 26-week real-world performance study with strength athletes in Vienna. The goal is simple: understand how training, nutrition, recovery and biomarkers interact over time — and translate that complexity into better coaching. The data layer includes workout logs, nutrition tracking, wearable signals, glucose data, lactate measurements, blood panels, microbiome analysis, body composition and performance testing. This is science made usable. Not a dashboard. Not a generic fitness app. A performance system.",
    "cta": "Explore the Science",
    "disclaimer": "Thalos is a performance and fitness coaching platform. It does not provide medical diagnoses or therapy recommendations."
  },
  "youAreUnique": {
    "eyebrow": "Built around you",
    "title": "You are unique. Train unique.",
    "body": "Generic plans create generic results. Your body does not adapt like everyone else's. Your sleep is different. Your recovery is different. Your nutrition is different. Your stress is different. Your response to training is different. Thalos builds around that difference. The longer you train with Thalos, the sharper your performance profile becomes — and the more precisely your coach can adapt.",
    "highlight": "Your data is the edge."
  },
  "athletes": {
    "title": "For people who train seriously.",
    "subtitle": "Thalos is built for athletes, coaches and high-performance gym members who want progress they can measure.",
    "audiences": {
      "strength": { "title": "Strength Athletes", "body": "Track volume, intensity, meals, recovery and progress in one system." },
      "crossfit": { "title": "CrossFit & Hybrid Athletes", "body": "Connect workload, recovery and nutrition across changing training demands." },
      "coaches": { "title": "Coaches", "body": "See more than a session. Understand the context behind performance." },
      "founding": { "title": "Founding Athletes", "body": "Train. Measure. Contribute to the next generation of AI performance coaching." }
    },
    "cta": "Become a Founding Athlete"
  },
  "foundingAthleteBeta": {
    "eyebrow": "Founding Athlete Beta",
    "headline": "The first 100 start ahead of everyone else.",
    "subheadline": "Beta launch. 100 spots. Polar360 device included.",
    "heroBody": "Thalos launches deliberately limited. We accept only the first 100 Founding Athletes. You get early access, daily and monthly status analytics, an included Polar360 device, Founding pricing with a 24-month price guarantee — and a clear head start once the forward-looking algorithms go live.",
    "uniqueLine": "You are unique. Train unique.",
    "microcopy": "Engineer Performance. Deep Hack the Human Body.",
    "ctaLearnMore": "See the beta program",
    "ctaApply": "Apply as Founding Athlete",
    "ctaBecome": "Become a Founding Athlete",
    "backHome": "Back to home",
    "teaserNote": "100 spots · Polar360 device included · 24-month price guarantee",
    "pass": {
      "badge": "Beta · 100 spots",
      "priceLabel": "Founding price",
      "priceSuffix": "/ month incl. VAT",
      "priceNote": "Equals €15 net plus 20% VAT.",
      "items": "Polar360 device included|24-month price guarantee|Status Analytics – daily & monthly|Early access + data advantage|Optional: spot in the Thalos Table"
    },
    "plans": {
      "heading": "Three tiers. One clear advantage for the first 100.",
      "foundingName": "Founding Athlete",
      "foundingBadge": "Limited",
      "foundingAmount": "€18",
      "foundingSuffix": "/ month incl. VAT",
      "foundingFeat": "Polar360 device included · 24-month price guarantee.",
      "fullName": "Full version",
      "fullAmount": "€50",
      "fullSuffix": "/ month incl. VAT",
      "fullFeat": "After the beta, without the Founding advantage.",
      "eliteName": "Elite",
      "eliteAmount": "€100",
      "eliteSuffix": "/ month incl. VAT",
      "eliteFeat": "Maximum depth and guidance."
    },
    "cards": {
      "spots": { "title": "100 spots", "body": "The beta launch is limited. Only the first 100 users are accepted as Founding Athletes." },
      "price": { "title": "€18 / month", "body": "Founding pricing (incl. VAT) with a 24-month price guarantee. Polar360 device included." },
      "data": { "title": "Data advantage", "body": "The data you collect now builds your performance profile before the forward-looking algorithms go live." },
      "status": { "title": "Status Analytics live", "body": "Today, Thalos analyzes what happened: training daily on the next day, workout and nutrition monthly." }
    },
    "why": {
      "eyebrow": "Why start now",
      "title": "Your head start begins with the first data point.",
      "p1": "Every training session, every nutrition log, every recovery night and every wearable signal sharpens your individual performance profile.",
      "p2": "Once the forward-looking algorithms go live at the end of Q3 / beginning of Q4 2026, Thalos does not start from zero. Your history is already there. Your pattern is already visible. Your coach can build on your real behavior.",
      "highlight": "That is the Founding Athlete advantage."
    },
    "today": {
      "eyebrow": "What is active today",
      "title": "Today, Thalos is your Status Analytics System.",
      "intro": "In beta, Thalos analyzes what happened — clear, short and performance-oriented.",
      "dailyLabel": "Daily",
      "daily": "A next-day short update on yesterday's training sessions.",
      "workoutLabel": "Monthly",
      "workout": "Workout analytics on structure, volume, intensity and development.",
      "nutritionLabel": "Monthly",
      "nutrition": "Nutrition analytics on your nutrition behavior and consistency.",
      "outro": "No noise. No generic tips. Structured feedback from your data."
    },
    "next": {
      "eyebrow": "What comes next",
      "title": "Today: understand. Next: predict.",
      "p1": "The forward-looking algorithms are not active in the beta yet.",
      "p2": "After the study closes on 31 August 2026, the models for prediction, adaptive planning and forward-looking recommendations will be developed and deployed. Planned rollout: end of Q3 / beginning of Q4 2026.",
      "p3": "Then Thalos moves from status system to forward-looking AI Performance Coach for training, nutrition and recovery."
    },
    "device": {
      "eyebrow": "Device, CGM & lactate",
      "title": "More signal. More context. Better analytics.",
      "polar": "The Polar360 device is included in the Founding Athlete price. It provides continuous baseline data — similar to Polar Loop — and makes your performance profile denser.",
      "polarTerms": "If you cancel within the first 12 months, you return the device or keep it and pay the prorated remaining amount.",
      "cgm": "CGM data should currently be integrated through Apple Health. In the study, we use Dexcom G7. Dexcom G7 is available through Thalos.",
      "lactate": "Lactate measurements are optional, but valuable — especially if you want to understand training intensity more precisely. In the study, we use the EKF Lactate Scout Sport. Loan devices are available through Thalos."
    },
    "price": {
      "eyebrow": "Founding Athlete price",